{
  "title": "PluginChangeResult",
  "$schema": "https://json-schema.org/draft/2020-12/schema",
  "type": "object",
  "properties": {
    "action": {
      "type": "string",
      "enum": [
        "added",
        "replaced",
        "removed"
      ]
    },
    "plugin": {
      "type": "object",
      "properties": {
        "name": {
          "type": "string",
          "minLength": 1
        },
        "artifact": {
          "type": "string",
          "minLength": 1
        },
        "source": {
          "type": "string",
          "minLength": 1
        },
        "addedAt": {
          "type": "string",
          "minLength": 1
        },
        "tools": {
          "type": "array",
          "items": {
            "type": "object",
            "properties": {
              "name": {
                "type": "string",
                "minLength": 1
              },
              "summary": {
                "type": "string",
                "minLength": 1
              },
              "dangerous": {
                "type": "boolean"
              },
              "parameters": {
                "type": "array",
                "items": {
                  "type": "object",
                  "properties": {
                    "name": {
                      "type": "string",
                      "minLength": 1
                    },
                    "type": {
                      "type": "string",
                      "enum": [
                        "string",
                        "number",
                        "boolean",
                        "object",
                        "array"
                      ]
                    },
                    "required": {
                      "type": "boolean"
                    },
                    "description": {
                      "type": "string",
                      "minLength": 1
                    },
                    "allowedValues": {
                      "minItems": 1,
                      "type": "array",
                      "items": {
                        "type": "string"
                      }
                    }
                  },
                  "required": [
                    "name",
                    "type",
                    "required",
                    "description"
                  ],
                  "additionalProperties": false
                }
              }
            },
            "required": [
              "name",
              "summary",
              "dangerous",
              "parameters"
            ],
            "additionalProperties": false
          }
        },
        "capabilities": {
          "type": "array",
          "items": {
            "type": "string",
            "minLength": 1
          }
        }
      },
      "required": [
        "name",
        "artifact",
        "source",
        "addedAt",
        "tools",
        "capabilities"
      ],
      "additionalProperties": false
    },
    "added": {
      "type": "array",
      "items": {
        "type": "object",
        "properties": {
          "id": {
            "type": "string",
            "minLength": 1
          },
          "risk": {
            "type": "string",
            "enum": [
              "safe",
              "normal",
              "dangerous"
            ]
          },
          "summary": {
            "type": "string",
            "minLength": 1
          },
          "parameters": {
            "type": "array",
            "items": {
              "type": "object",
              "properties": {
                "name": {
                  "type": "string",
                  "minLength": 1
                },
                "type": {
                  "type": "string",
                  "enum": [
                    "string",
                    "number",
                    "boolean",
                    "object",
                    "array"
                  ]
                },
                "required": {
                  "type": "boolean"
                },
                "description": {
                  "type": "string",
                  "minLength": 1
                },
                "allowedValues": {
                  "minItems": 1,
                  "type": "array",
                  "items": {
                    "type": "string"
                  }
                }
              },
              "required": [
                "name",
                "type",
                "required",
                "description"
              ],
              "additionalProperties": false
            }
          },
          "cliAlias": {
            "minItems": 1,
            "type": "array",
            "items": {
              "type": "string",
              "minLength": 1
            }
          },
          "confirmation": {
            "type": "string",
            "enum": [
              "confirm-agent",
              "os-dialog"
            ]
          }
        },
        "required": [
          "id",
          "risk",
          "summary",
          "parameters"
        ],
        "additionalProperties": false
      }
    },
    "removed": {
      "type": "array",
      "items": {
        "type": "string",
        "minLength": 1
      }
    }
  },
  "required": [
    "action",
    "plugin",
    "added",
    "removed"
  ],
  "additionalProperties": false
}
